title,url,content,tags,date
Brewers Acquire Mark Canha From Mets,https://www.mlbtraderumors.com/2023/07/brewers-to-acquire-mark-canha-from-mets.html,"The Brewers have acquired first baseman/outfielder Mark Canha from the Mets, with pitching prospect Justin Jarvis going the other way, per announcements from both clubs. The Brewers opened a 40-man roster spot earlier when Jake Cousins was lost to the Astros off waivers. The Mets are paying Canha’s salary this year, with the Brewers only responsible for the prorated league minimum portion, though Milwaukee will be on the hook for the option or buyout when they make their decision on that.
This is the second offensive upgrade of the deadline for the Brewers, who already acquired Carlos Santana from the Pirates last week. It was reported earlier today that the club was still looking to upgrade its lineup and has done so here.

Canha, 34, spent many years as a solid outfielder for the Athletics before reaching free agency after 2021. He was able to secure himself a two-year, $26.5MM deal going into 2022, with an $11.5MM club option for 2024 that comes with a $2MM buyout. He hit .266/.367/.403 for the Mets last year, a line that translated to a wRC+ of 128, indicating he was 28% above league average.
This year, Canha’s production has slipped a bit, though he still an above-average hitter. His .245/.343/.381 line thus far on the season amounts to a 107 wRC+, seven percent better than par but a dip from a year ago. It’s possible there’s some bad luck in there, as his .279 batting average on balls in play is well below last year’s .309 mark, despite the fact that his barrel rate, hard hit rate and exit velocity have all gone up in 2023 relative to 2022. Perhaps he’s due for some positive regression, though he’s a solid hitter even without it.
Defensively, Canha is primarily an outfielder, though he has some versatility. He’s played more left field than anywhere else but he’s capable of playing all three outfield slots, in addition brief spells at the infield corners. Milwaukee has been using an outfield of Christian Yelich, Joey Wiemer and Sal Frelick in recent days. Yelich is having a terrific season whereas Wiemer’s contributions have been mixed. His defense has been highly rated and he has 11 steals on the year, but he’s hitting just .209/.289/.381 for a wRC+ of 82. Frelick was called up just over a week ago but has started his major league career with a .304/.438/.478 showing. Tyrone Taylor and Blake Perkins haven’t hit much in reserve roles.
Frelick played plenty of center field in the minors so perhaps he could move there with Canha taking right and Yelich in left. Frelick also hits left-handed and Wiemer right-handed, so perhaps they could platoon up the middle. Wiemer is hitting .282/.315/.576 against lefties but just .180/.280/.304 without the platoon advantage. The club also doesn’t have a regular designated hitter and could perhaps get all of these players in the lineup if that seems like the best option at the time. Though Santana figures to be the regular at first base, Canha’s ability to play there gives them some extra flexibility. Brian Anderson could also be in the mix at some point with Andruw Monasterio playing well at third, though the latter could also move over to second and bump out the struggling Brice Turang.
The Brewers are generally a fairly low-spending club, so the Mets’ willingness to pay down the deal surely appealed to them. They will have to decide on that option versus that buyout, which could depend on Canha’s performance to finish the year. The Brewers will still have Yelich, Frelick and Wiemer next year, along with hopefully getting Garrett Mitchell back after he’s missing most of this year due to shoulder surgery. There’s also the looming presence of Jackson Chourio, one of the top prospects in the league, who is currently in Double-A.
Next year’s outfield seems a bit more crowded, though perhaps first base is different. The Brewers are set to lose Santana to free agency, which could make their Rowdy Tellez situation significant. He can be retained for one more season via arbitration but has been terrible here in 2023, hitting .213/.285/.388 and is currently on the injured list, making him a non-tender candidate this winter. If Canha proves to be a good fit, perhaps they pick up that option and keep him around at first.
However it plays out down the road, it should help the Brewers now. They are currently 57-49, just half a game back of the Reds in the National League Central and currently in possession of a Wild Card slot. That’s largely come on the backs of their pitching, as the team as a whole has hit .232/.312/.377 for a wRC+ of 88, leading to their additions of Santana and Canha.
For the Mets, this is the latest in their deadline selloff, something that would have seemed shocking a few months ago. This winter, they ran up the biggest payroll in MLB history to try to build upon their 101-win season last year. But they disappointed badly enough that they have been aggressively selling. They’ve already flipped out Eduardo Escobar to the Angels, David Robertson to the Marlins, Max Scherzer to the Rangers and now this deal. In most cases, they have eaten significant money in order to effectively buy prospects. Canha is making a salary of $10.5MM this year, with about $3.5MM left to be paid out, the majority of which will be swallowed by the Mets.

Their return for surrendering Canha and eating that money will be Jarvis. The 23-year-old right-hander was selected by the Brewers in the fifth round of the 2018 draft and has shown some signs of progress recently. Last year, he split his time between High-A and Double-A, throwing 141 innings with a 3.83 ERA, 25% strikeout rate and 11% walk rate. He returned to Double-A to start this year and posted a 3.33 ERA through 14 starts, striking out 28.6% of opponents while walking just 8.2%. He recently got bumped to Triple-A and has been shelled, but in a small sample of just three outings.
Based on those strong Double-A results, he was recently ranked the #12 prospect in the Brewers’ system by Baseball America, who highlighted his four-pitch mix as giving him a chance to stick in a big league rotation. He’ll give the Mets some upper level rotation depth, though he’ll need to be added to the 40-man roster this winter or else he’ll be available to be selected in the upcoming Rule 5 draft.
Before tomorrow’s deadline, the Mets figure to continue adding to their farm system with similar deals. Tommy Pham, Brooks Raley, Adam Ottavino, Carlos Carrasco, José Quintana and Omar Narváez all seem like possibilities. Justin Verlander has been speculated upon, though his large contract complicates things. The Brewers could also look to make further additions before tomorrow’s deadline, which is at 5pm Central.
 Will Sammon of The Athletic first reported the Brewers were acquiring Canha. Andy Martino of SNY first reported that Jarvis was going the other way. Martino relayed that the Mets were paying down Canha’s salary and Sammon added that the Brewers would be on the hook for the buyout/option.",Milwaukee Brewers;New York Mets;Newsstand;Transactions,2023-07-31
"Guardians Claim Lucas Giolito, Reynaldo Lopez, Matt Moore",https://www.mlbtraderumors.com/2023/08/reinsdorf-no-intention-to-sell-white-sox.html,"In a swift retooling of the pitching staff, the Guardians have claimed right-handers Lucas Giolito and Reynaldo Lopez and lefty Matt Moore off waivers from the Angels, Jeff Passan and Kiley McDaniel of ESPN report. It’s a sudden, jarring final push to salvage a postseason appearance by Cleveland — one that would have seemed impossible just 72 hours ago.
The Angels’ decision to place roughly a quarter of their roster on waivers — Hunter Renfroe, Randal Grichuk and Dominic Leone all hit waivers on Tuesday as well — stunned the industry, though the rationale behind it is at least sound. The Angels aggressively pushed for a postseason berth at the deadline, acquiring Giolito, Lopez, Grichuk and C.J. Cron, but have since lost two-thirds of their games and fallen from postseason contention in a stacked AL West. (Somewhat amusingly, their 64-70 record is the same as the Guardians, though the AL Central is the sport’s weakest division.)
That slate of trades pushed the Halos over the luxury tax threshold, which would reduce their draft compensation in the event that Shohei Ohtani signs elsewhere after rejecting a qualifying offer. They’d also face steeper penalties in 2024 in the event that they exceeded the tax barrier next year. But, by waiving this slate of players and seeing each of Giolito, Lopez, Moore, Renfroe (Reds) and Leone (Mariners) all come off the books, the Angels will duck back under the tax threshold. Their theoretical comp pick for Ohtani’s departure would come prior to the third round of the draft rather than between the fourth and fifth rounds. They also won’t face any escalating penalties in the event that they wind up as a luxury tax payor next season.
It’s a bad look for MLB to see such a brazenly non-competitive move by a team that just four weeks ago energized its fanbase and clubhouse with a bold win-now push. At the same time, the Angels can’t really be faulted for the decision at this juncture, given the manner in which things have played out. They’re merely taking advantage of the rules that have been collectively bargained between the league and the Players Association. None of the players they waived would’ve been eligible or considered for a qualifying offer anyhow, so there’s quite literally no incentive for the Angels to hold onto them and strong incentive for them to engage in this tactic now that their playoff hopes are all but mathematically dashed.
While Major League Baseball perhaps ought to look into ways to prevent mass roster purges of this nature in future Augusts, there’s little to be done about it now — and the Guardians stand to benefit. Cleveland has spent the entirety of the year looking up at the Twins in the American League Central standings, and after taking two of three from Minnesota in their just-completed series now faces only a five-game deficit. It’s worth wondering what might’ve happened if the Twins had swept or at least won the series — Minnesota was within one strike of winning yesterday’s game, but the bullpen couldn’t hold the lead — though perhaps Cleveland would’ve made the claims even if facing a six- or seven-game deficit.
A firm answer to that hypothetical probably can’t ever be known, but it’s a moot point anyhow; the Guardians’ comeback win yesterday brought them within striking distance of the Twins in the division, and they’ll now add three high-caliber arms to their pitching staff. Giolito, of course, is the most notable of the bunch and perhaps the most vital, given the extent of the pitching injuries that have ravaged the Cleveland rotation this year. Each of Shane Bieber, Triston McKenzie and Cal Quantrill has been out more seven weeks. The Guardians, acknowledging that their playoff hopes had slipped, traded Aaron Civale to the Rays prior to the deadline.

Giolito joins a rookie-laden rotation, adding a veteran arm to stand alongside the impressive trio of Tanner Bibee, Gavin Williams and Logan Allen. The expectation is that Quantrill will soon be ready to join that group, and the club has also expressed optimism that Bieber could return late in the month.
While the 2023 season has been Giolito’s worst in recent memory, that’s largely due to poor results with the team that just waived him. After pitching to a 3.79 ERA with a 25.8% strikeout rate and 8.3% walk rate in 121 innings with the White Sox, Giolito was torched for a 6.89 ERA with worse strikeout (22.8%) and walk (10.3%) rates as a member of the Halos. Most dramatically, an already too-high home run rate of 1.49 per nine innings pitched spiked to 2.76 as an Angel.
Looking at Giolito’s track record as a whole, however, it’s easy enough to see why he was claimed by several teams (the others all having lower waiver priority than Cleveland). Dating back to 2019, Giolito sports a 3.99 ERA in 743 innings. His strikeout rate has dipped over the past two seasons, but he’s still averaging 93-94 mph on his heater, punching out about a quarter of his opponents, and has generally shown good command throughout his MLB career. The Cy Young-caliber breakout many expected perhaps never came, but Giolito is a durable mid-rotation arm who misses bats, limits walks and is a playoff-caliber arm.
Meanwhile, an already excellent Cleveland bullpen will now add two formidable arms in Lopez and Moore. Guardians relievers already rank fifth in the Majors with a 3.48 ERA, and the addition of two veterans just in time for rosters to expand will put them in the conversation for best relief corps in baseball.

Lopez, 29, is one of MLB’s hardest throwers, averaging a blistering 98.4 mph on his heater this year. He’s seen his previously strong command erode in 2023, walking a career-worst 12.6% of his opponents, but he’s also fanning a career-best 29.8% of hitters and boasting a career-high 14.1% swinging-strike rate. In 55 innings of relief, the former top prospect has a 3.93 ERA. Lopez is limiting hard contact at the best levels of his career as well and throwing his blazing fastball more often than ever before — generally at the expense of his third and fourth pitches (curveball, changeup). He’s primarily been a fastball/slider pitcher this year, and while the results have been a bit mixed, he’ll add a power arm capable of missing bats in droves to Terry Francona’s bullpen.
Moore, meanwhile, gives Francona a second lefty alongside Sam Hentges. The 34-year-old has found new life in his career since moving to a full-time relief role last year. He’s pitched 44 innings for the Angels in 2023, working to a 2.66 ERA with a career-high 28% strikeout rate and a very strong 6.9% walk rate.

Once the game’s consensus top pitching prospect, Moore impressed early on with the Rays before Tommy John surgery derailed his career. The left-hander never seemed to fully recover. After pitching to a 3.53 ERA from 2011-14, he missed most of the 2014-15 seasons recovering from that surgery, and posted a 5.26 ERA over his next 620 2/3 innings post-surgery.
Moore had a one-year stop in Japan along the way and pitched fairly well there, but it wasn’t until signing a minor league deal with Texas last year that he became a pitcher of note at the big league level again. Moore’s 1.95 ERA set the stage for a $7.55MM deal with the Angels this year, and he’s now logged a combined 2.21 ERA in his career’s second act as a late-inning reliever.
All in all, it’s a borderline unheard-of boon to a Major League pitching staff at this stage of a season — and all it will cost the Guardians is the collective $3.727MM that remain on the trio’s 2023 contracts. Each of Giolito, Moore and Lopez will be a free agent after the season, and the Guardians won’t receive any compensation if and when they enter free agency. They’re still a long shot to erase that five-game gap in the standings, particularly with the Twins still having series against the A’s, Rockies, White Sox, Mets and a now-depleted Angels team. But the Guardians were presented an opportunity to do everything they could to boost their slim playoff odds, and just like the Angels did one month ago, they took their shot.",Cleveland Guardians;Los Angeles Angels;Newsstand;Transactions,2023-08-31
"Reds Claim Harrison Bader, Hunter Renfroe",https://www.mlbtraderumors.com/2023/08/reinsdorf-no-intention-to-sell-white-sox.html,"The Reds have claimed outfielder Harrison Bader off waivers from the Yankees, reports Jeff Passan of ESPN. The Reds also claimed outfielder Hunter Renfroe from the Angels, per Jesse Rogers of ESPN. By joining the Reds prior to September 1, each will be eligible to participate in the postseason if the club eventually makes it.
Bader, 29, and Renfroe, 31, were two of several veteran players placed on waivers this week. There were many clubs who were still hovering around contention at the trade deadline but slipped back in the standings in the month of August. But the opportunity to trade impending free agents for any kind of return had passed by, leaving them little recourse but to place those players on waivers. By doing so, they could perhaps at least save themselves some money since the claiming team takes on the remainder of the contract, while allowing the player to move somewhere with a chance to contend and perhaps make the playoffs.
Both Bader and Renfroe will do just that, jumping from their respective clubs to the Reds, who have emerged from their rebuild in amazing fashion this year. Several rookies have been called up and have been able to hit the ground running, allowing the club to currently find themselves just one game out of a National League Wild Card spot with a record of 69-66. They will now add a couple of veteran players into the mix for their stretch run, for nothing but a financial cost.
Bader has long been an excellent fielder in center, starting with the Cardinals and continuing with the Yankees after a trade last year. In 621 career games, he’s tallied 53 Defensive Runs Saved, 67 Outs Above Average and a grade of 46.7 from Ultimate Zone Rating. Injuries have been an ongoing issue, however, with Bader only twice playing in more than 103 games in a season. Those instances were back in 2018 and 2019, with multiple IL trips in the seasons since.
At the plate, he’s been less impressive than in the field, usually hovering around league average. His career batting line is .244/.312/.399, which translates to a wRC+ of 93, but he’s hitting just .240/.278/.365 this year for a 76 wRC+. But his speed has allowed him to steal 74 bases in his career, including 17 already this season.
Renfroe is effectively the inverse to Bader, as his bat his generally his best trait, with his speed and defense considered subpar. Though his offense is his standout trait, he’s inconsistent in that regard, with his production oscillating between either side of league average. Over 2021 and 2022, he hit 60 home runs and produced a batting line of .257/.315/.496, amounting to a wRC+ of 118. But this year, he’s down a bit to .242/.304/.434 and a 98 wRC+.
Despite each player’s value, the Yankees and Angels fell back in the standings in August and gave up on their hopes of contending. Both of these players are impending free agents and neither would warrant a qualifying offer at season’s end, so their respective clubs placed them on waivers in the hopes that another team would put in a claim and take the remainder of the contract off their hands.
The waiver priority order is the reverse of the standings, with the worst clubs having first dibs. But non-contending clubs would have no incentive for claiming these players, so they have naturally skipped to a contender. In this case, some other fringe contenders like the Guardians and Marlins passed on Bader and Renfroe, though the Reds benefited by being in the playoff race but with a worse record than some of the clubs they are battling.
By adding Renfroe and Bader into the mix, the Reds have further crowded their outfield picture. In recent days, they have had TJ Friedl in center, with Will Benson and Nick Senzel getting regular work in the corners, backed up by Stuart Fairchild and TJ Hopkins. There’s also Jake Fraley, who is on the injured list but currently on a rehab assignment. Spencer Steer has been covering second base with Matt McLain on the IL but could end up back in the outfield if McLain returns.
There’s a lot of moving parts there but the Reds will likely figure out a way to make it work. Senzel is hitting just .219/.289/.371 this year and could be bumped from the regular lineup by Renfroe. Friedl was hitting .313/.379/.486 through June but has slumped to a line of .221/.278/.352 since the calendar flipped to July, perhaps leading to Bader taking some of his playing time. There’s also the designated hitter slot, which has been used by Nick Martini of late. He’s been red hot but in a small sample of just nine games.
However it plays out, the Reds are taking on some money to try to push themselves into the postseason. Bader is making $4.7MM this year with around $783K left to be paid out, while Renfroe has about $1.98MM left on his $11.9MM salary. That leaves the Reds taking on close to $2.76MM in these moves, though the savings for the other clubs will be greater.
The Yankees are set to pay the luxury tax for a second straight year and have been hovering around the fourth CBT tier. That means they will be paying a 75% tax on any spending over the $273MM line and a 90% tax on any spending over the $293MM line. By having Bader claimed on waivers, they will save the remainder of his contract and also reduce their tax bill.
For the Angels, they were narrowly over the lowest CBT threshold and may be able to duck below. In addition to the Reds claiming Renfroe, the Guardians claimed Lucas Giolito, Matt Moore and Reynaldo López while the Mariners claimed Dominic Leone. In addition to the straightforward cost savings, those claims could potentially push them out of payor status, though that won’t be officially known until the offseason. If they did successfully avoid the tax, that would impact the draft pick they receive in the event Shohei Ohtani signs elsewhere after rejecting a qualifying offer. A team that pays the luxury tax sees their compensatory draft pick moved back from just before the third round to just after the fourth, moving from around pick 75-80 to around 140. There are also compounding penalties for repeat payors, meaning that getting below the line here in 2023 could have impacts for the Halos into the future as well.
Images courtesy of USA Today Sports.",Cincinnati Reds;Los Angeles Angels;New York Yankees;Newsstand;Transactions,2023-08-31
Brewers Sign Josh Donaldson To Minor League Deal,https://www.mlbtraderumors.com/2023/08/reinsdorf-no-intention-to-sell-white-sox.html,"The Brewers have signed Josh Donaldson to a minor league deal, per Todd Rosiak of the Milwaukee Journal Sentinel. The third baseman will report to Triple-A Nashville. By joining the organization prior to September 1, he will be eligible to play for the Brewers in the postseason.
Donaldson, 37, spent almost a decade one of the best third basemen in the league but has fallen on hard times of late. From 2013 to 2021, he hit 241 home runs and slashed .272/.373/.514 for a wRC+ of 141, indicating he was 41% better than the league average hitter in that time. But after being traded from the Twins to the Yankees prior to 2022, his production started to fall off. Last year, he hit .222/.308/.374 for a wRC+ of 98. His strikeout rate jumped to 27.1%, after being at 19.8% in that aforementioned stretch of excellence.
This year, he has hardly been able to take the field. He has twice gone on the injured list, first due to a right hamstring strain and then a right calf strain, only getting into 34 games on the season. He hit 10 home runs in that time but slashed just .142/.225/.434. He suffered through a tiny .076 batting average on balls in play in that time but his strikeout rate remained high at 26.7%.
He most recent IL stint began in mid-July, meaning he’s been out of action for about six weeks at this point. He was ramping up lately and nearing a rehab assignment but the Yankees released him earlier this week, giving him a chance to catch on elsewhere as they use the remainder of their lost season to get a look at younger players. Donaldson has now found that new chance with the Brewers.
Milwaukee has been using Andruw Monasterio as its primary third baseman in recent months, but he has cooled off lately. He was hitting .288/.369/.410 through August 14 but just .149/.216/.149 in his past 13 games. Brian Anderson has also seen some time at the hot corner but has experienced a similar cooldown. He was hitting .229/.317/.373 when he landed on the injured list in July due to a lower back strain. Since returning earlier this month, he’s hit just .150/.190/.250. Donaldson could also possibly nudge Carlos Santana, who has hit .219/.281/.419 since being acquired by the Brewers, from some time as the designated hitter.
Perhaps the Brewers will add Donaldson to their roster and try to catch lightning in a bottle to improve their output at third. Donaldson’s overall results haven’t been great but he’s still been good on defense and he won’t be able to sustain that tiny BABIP going forward. Active rosters expand from 26 to 28 tomorrow but Donaldson will need a 40-man spot if the Brewers decide to add him. Since he was set to go on a rehab assignment anyway, perhaps he goes to Nashville for a few days to get back into game shape.
The Brewers are currently atop the National League Central but the Cubs and Reds are within three and six games, respectively. For now, they are taking a no-risk look at Donaldson to see what form he’s in and if he can help them with their playoff push or maybe in the playoffs themselves. If they add him to the roster at any point, they will only owe him the prorated league minimum, since the Yanks are on the hook for the majority of what remains of his contract by releasing him.",Milwaukee Brewers;Newsstand;Transactions,2023-08-31
